\set VERBOSITY terse
CREATE SCHEMA pathman;
CREATE EXTENSION pg_pathman SCHEMA pathman;
CREATE SCHEMA test;
CREATE TABLE test.hash_rel (
    id      SERIAL PRIMARY KEY,
    value   INTEGER);
INSERT INTO test.hash_rel VALUES (1, 1);
INSERT INTO test.hash_rel VALUES (2, 2);
INSERT INTO test.hash_rel VALUES (3, 3);
SELECT pathman.create_hash_partitions('test.hash_rel', 'value', 3);
ERROR:  Partitioning key 'value' must be NOT NULL
ALTER TABLE test.hash_rel ALTER COLUMN value SET NOT NULL;
SELECT pathman.create_hash_partitions('test.hash_rel', 'value', 3);
NOTICE:  function test.hash_rel_hash_insert_trigger_func() does not exist, skipping
NOTICE:  function test.hash_rel_hash_update_trigger_func() does not exist, skipping
NOTICE:  Copying data to partitions...
 create_hash_partitions 
------------------------
                      3
(1 row)

SELECT COUNT(*) FROM test.hash_rel;
 count 
-------
     3
(1 row)

SELECT COUNT(*) FROM ONLY test.hash_rel;
 count 
-------
     0
(1 row)

INSERT INTO test.hash_rel VALUES (4, 4);
INSERT INTO test.hash_rel VALUES (5, 5);
INSERT INTO test.hash_rel VALUES (6, 6);
SELECT COUNT(*) FROM test.hash_rel;
 count 
-------
     6
(1 row)

SELECT COUNT(*) FROM ONLY test.hash_rel;
 count 
-------
     0
(1 row)

CREATE TABLE test.range_rel (
    id SERIAL PRIMARY KEY,
    dt TIMESTAMP,
    txt TEXT);
CREATE INDEX ON test.range_rel (dt);
INSERT INTO test.range_rel (dt, txt)
SELECT g, md5(g::TEXT) FROM generate_series('2015-01-01', '2015-04-30', '1 day'::interval) as g;
SELECT pathman.create_range_partitions('test.range_rel', 'dt', '2015-01-01'::DATE, '1 month'::INTERVAL, 2);
ERROR:  Partitioning key 'dt' must be NOT NULL P0001
ALTER TABLE test.range_rel ALTER COLUMN dt SET NOT NULL;
SELECT pathman.create_range_partitions('test.range_rel', 'dt', '2015-01-01'::DATE, '1 month'::INTERVAL, 2);
ERROR:  Not enough partitions to fit all the values of 'dt' P0001
SELECT pathman.create_range_partitions('test.range_rel', 'dt', '2015-01-01'::DATE, '1 month'::INTERVAL);
NOTICE:  sequence "range_rel_seq" does not exist, skipping
NOTICE:  Copying data to partitions...
 create_range_partitions 
-------------------------
                       4
(1 row)

SELECT COUNT(*) FROM test.range_rel;
 count 
-------
   120
(1 row)

SELECT COUNT(*) FROM ONLY test.range_rel;
 count 
-------
     0
(1 row)

CREATE TABLE test.num_range_rel (
    id SERIAL PRIMARY KEY,
    txt TEXT);
SELECT pathman.create_range_partitions('test.num_range_rel', 'id', 0, 1000, 4);
NOTICE:  sequence "num_range_rel_seq" does not exist, skipping
NOTICE:  Copying data to partitions...
 create_range_partitions 
-------------------------
                       4
(1 row)

SELECT COUNT(*) FROM test.num_range_rel;
 count 
-------
     0
(1 row)

SELECT COUNT(*) FROM ONLY test.num_range_rel;
 count 
-------
     0
(1 row)

INSERT INTO test.num_range_rel
    SELECT g, md5(g::TEXT) FROM generate_series(1, 3000) as g;
SELECT COUNT(*) FROM test.num_range_rel;
 count 
-------
  3000
(1 row)

SELECT COUNT(*) FROM ONLY test.num_range_rel;
 count 
-------
     0
(1 row)

VACUUM;
/* update triggers test */
SELECT pathman.create_hash_update_trigger('test.hash_rel');
 create_hash_update_trigger 
----------------------------
 
(1 row)

UPDATE test.hash_rel SET value = 7 WHERE value = 6;
EXPLAIN (COSTS OFF) SELECT * FROM test.hash_rel WHERE value = 7;
          QUERY PLAN          
------------------------------
 Append
   ->  Seq Scan on hash_rel_1
         Filter: (value = 7)
(3 rows)

SELECT * FROM test.hash_rel WHERE value = 7;
 id | value 
----+-------
  6 |     7
(1 row)

SELECT pathman.create_range_update_trigger('test.num_range_rel');
       create_range_update_trigger        
------------------------------------------
 test.num_range_rel_update_trigger_func()
(1 row)

UPDATE test.num_range_rel SET id = 3001 WHERE id = 1;
EXPLAIN (COSTS OFF) SELECT * FROM test.num_range_rel WHERE id = 3001;
            QUERY PLAN             
-----------------------------------
 Append
   ->  Seq Scan on num_range_rel_4
         Filter: (id = 3001)
(3 rows)

SELECT * FROM test.num_range_rel WHERE id = 3001;
  id  |               txt                
------+----------------------------------
 3001 | c4ca4238a0b923820dcc509a6f75849b
(1 row)

SET enable_indexscan = OFF;
SET enable_bitmapscan = OFF;
SET enable_seqscan = ON;
EXPLAIN (COSTS OFF) SELECT * FROM test.hash_rel;
          QUERY PLAN          
------------------------------
 Append
   ->  Seq Scan on hash_rel_0
   ->  Seq Scan on hash_rel_1
   ->  Seq Scan on hash_rel_2
(4 rows)

EXPLAIN (COSTS OFF) SELECT * FROM test.hash_rel WHERE value = 2;
          QUERY PLAN          
------------------------------
 Append
   ->  Seq Scan on hash_rel_2
         Filter: (value = 2)
(3 rows)

EXPLAIN (COSTS OFF) SELECT * FROM test.hash_rel WHERE value = 2 OR value = 1;
          QUERY PLAN          
------------------------------
 Append
   ->  Seq Scan on hash_rel_1
         Filter: (value = 1)
   ->  Seq Scan on hash_rel_2
         Filter: (value = 2)
(5 rows)

EXPLAIN (COSTS OFF) SELECT * FROM test.num_range_rel WHERE id > 2500;
            QUERY PLAN             
-----------------------------------
 Append
   ->  Seq Scan on num_range_rel_3
         Filter: (id > 2500)
   ->  Seq Scan on num_range_rel_4
(4 rows)

EXPLAIN (COSTS OFF) SELECT * FROM test.num_range_rel WHERE id >= 1000 AND id < 3000;
            QUERY PLAN             
-----------------------------------
 Append
   ->  Seq Scan on num_range_rel_2
   ->  Seq Scan on num_range_rel_3
(3 rows)

EXPLAIN (COSTS OFF) SELECT * FROM test.num_range_rel WHERE id >= 1500 AND id < 2500;
            QUERY PLAN             
-----------------------------------
 Append
   ->  Seq Scan on num_range_rel_2
         Filter: (id >= 1500)
   ->  Seq Scan on num_range_rel_3
         Filter: (id < 2500)
(5 rows)

EXPLAIN (COSTS OFF) SELECT * FROM test.num_range_rel WHERE (id >= 500 AND id < 1500) OR (id > 2500);
            QUERY PLAN             
-----------------------------------
 Append
   ->  Seq Scan on num_range_rel_1
         Filter: (id >= 500)
   ->  Seq Scan on num_range_rel_2
         Filter: (id < 1500)
   ->  Seq Scan on num_range_rel_3
         Filter: (id > 2500)
   ->  Seq Scan on num_range_rel_4
(8 rows)

EXPLAIN (COSTS OFF) SELECT * FROM test.range_rel WHERE dt > '2015-02-15';
                                   QUERY PLAN                                   
--------------------------------------------------------------------------------
 Append
   ->  Seq Scan on range_rel_2
         Filter: (dt > 'Sun Feb 15 00:00:00 2015'::timestamp without time zone)
   ->  Seq Scan on range_rel_3
   ->  Seq Scan on range_rel_4
(5 rows)

EXPLAIN (COSTS OFF) SELECT * FROM test.range_rel WHERE dt >= '2015-02-01' AND dt < '2015-03-01';
          QUERY PLAN           
-------------------------------
 Append
   ->  Seq Scan on range_rel_2
(2 rows)

EXPLAIN (COSTS OFF) SELECT * FROM test.range_rel WHERE dt >= '2015-02-15' AND dt < '2015-03-15';
                                   QUERY PLAN                                    
---------------------------------------------------------------------------------
 Append
   ->  Seq Scan on range_rel_2
         Filter: (dt >= 'Sun Feb 15 00:00:00 2015'::timestamp without time zone)
   ->  Seq Scan on range_rel_3
         Filter: (dt < 'Sun Mar 15 00:00:00 2015'::timestamp without time zone)
(5 rows)

EXPLAIN (COSTS OFF) SELECT * FROM test.range_rel WHERE (dt >= '2015-01-15' AND dt < '2015-02-15') OR (dt > '2015-03-15');
                                   QUERY PLAN                                    
---------------------------------------------------------------------------------
 Append
   ->  Seq Scan on range_rel_1
         Filter: (dt >= 'Thu Jan 15 00:00:00 2015'::timestamp without time zone)
   ->  Seq Scan on range_rel_2
         Filter: (dt < 'Sun Feb 15 00:00:00 2015'::timestamp without time zone)
   ->  Seq Scan on range_rel_3
         Filter: (dt > 'Sun Mar 15 00:00:00 2015'::timestamp without time zone)
   ->  Seq Scan on range_rel_4
(8 rows)

SET enable_indexscan = ON;
SET enable_bitmapscan = OFF;
SET enable_seqscan = OFF;
EXPLAIN (COSTS OFF) SELECT * FROM test.hash_rel;
          QUERY PLAN          
------------------------------
 Append
   ->  Seq Scan on hash_rel_0
   ->  Seq Scan on hash_rel_1
   ->  Seq Scan on hash_rel_2
(4 rows)

EXPLAIN (COSTS OFF) SELECT * FROM test.hash_rel WHERE value = 2;
          QUERY PLAN          
------------------------------
 Append
   ->  Seq Scan on hash_rel_2
         Filter: (value = 2)
(3 rows)

EXPLAIN (COSTS OFF) SELECT * FROM test.hash_rel WHERE value = 2 OR value = 1;
          QUERY PLAN          
------------------------------
 Append
   ->  Seq Scan on hash_rel_1
         Filter: (value = 1)
   ->  Seq Scan on hash_rel_2
         Filter: (value = 2)
(5 rows)

EXPLAIN (COSTS OFF) SELECT * FROM test.num_range_rel WHERE id > 2500;
                           QUERY PLAN                           
----------------------------------------------------------------
 Append
   ->  Index Scan using num_range_rel_3_pkey on num_range_rel_3
         Index Cond: (id > 2500)
   ->  Seq Scan on num_range_rel_4
(4 rows)

EXPLAIN (COSTS OFF) SELECT * FROM test.num_range_rel WHERE id >= 1000 AND id < 3000;
            QUERY PLAN             
-----------------------------------
 Append
   ->  Seq Scan on num_range_rel_2
   ->  Seq Scan on num_range_rel_3
(3 rows)

EXPLAIN (COSTS OFF) SELECT * FROM test.num_range_rel WHERE id >= 1500 AND id < 2500;
                           QUERY PLAN                           
----------------------------------------------------------------
 Append
   ->  Index Scan using num_range_rel_2_pkey on num_range_rel_2
         Index Cond: (id >= 1500)
   ->  Index Scan using num_range_rel_3_pkey on num_range_rel_3
         Index Cond: (id < 2500)
(5 rows)

EXPLAIN (COSTS OFF) SELECT * FROM test.num_range_rel WHERE (id >= 500 AND id < 1500) OR (id > 2500);
                           QUERY PLAN                           
----------------------------------------------------------------
 Append
   ->  Index Scan using num_range_rel_1_pkey on num_range_rel_1
         Index Cond: (id >= 500)
   ->  Index Scan using num_range_rel_2_pkey on num_range_rel_2
         Index Cond: (id < 1500)
   ->  Index Scan using num_range_rel_3_pkey on num_range_rel_3
         Index Cond: (id > 2500)
   ->  Seq Scan on num_range_rel_4
(8 rows)

EXPLAIN (COSTS OFF) SELECT * FROM test.range_rel WHERE dt > '2015-02-15';
                                     QUERY PLAN                                     
------------------------------------------------------------------------------------
 Append
   ->  Index Scan using range_rel_2_dt_idx on range_rel_2
         Index Cond: (dt > 'Sun Feb 15 00:00:00 2015'::timestamp without time zone)
   ->  Seq Scan on range_rel_3
   ->  Seq Scan on range_rel_4
(5 rows)

EXPLAIN (COSTS OFF) SELECT * FROM test.range_rel WHERE dt >= '2015-02-01' AND dt < '2015-03-01';
          QUERY PLAN           
-------------------------------
 Append
   ->  Seq Scan on range_rel_2
(2 rows)

EXPLAIN (COSTS OFF) SELECT * FROM test.range_rel WHERE dt >= '2015-02-15' AND dt < '2015-03-15';
                                     QUERY PLAN                                      
-------------------------------------------------------------------------------------
 Append
   ->  Index Scan using range_rel_2_dt_idx on range_rel_2
         Index Cond: (dt >= 'Sun Feb 15 00:00:00 2015'::timestamp without time zone)
   ->  Index Scan using range_rel_3_dt_idx on range_rel_3
         Index Cond: (dt < 'Sun Mar 15 00:00:00 2015'::timestamp without time zone)
(5 rows)

EXPLAIN (COSTS OFF) SELECT * FROM test.range_rel WHERE (dt >= '2015-01-15' AND dt < '2015-02-15') OR (dt > '2015-03-15');
                                     QUERY PLAN                                      
-------------------------------------------------------------------------------------
 Append
   ->  Index Scan using range_rel_1_dt_idx on range_rel_1
         Index Cond: (dt >= 'Thu Jan 15 00:00:00 2015'::timestamp without time zone)
   ->  Index Scan using range_rel_2_dt_idx on range_rel_2
         Index Cond: (dt < 'Sun Feb 15 00:00:00 2015'::timestamp without time zone)
   ->  Index Scan using range_rel_3_dt_idx on range_rel_3
         Index Cond: (dt > 'Sun Mar 15 00:00:00 2015'::timestamp without time zone)
   ->  Seq Scan on range_rel_4
(8 rows)

/*
 * Test split and merge
 */
/* Split first partition in half */
SELECT pathman.split_range_partition('test.num_range_rel_1', 500);
NOTICE:  Creating new partition...
NOTICE:  Copying data to new partition...
NOTICE:  Altering original partition...
NOTICE:  Done!
 split_range_partition 
-----------------------
 {0,1000}
(1 row)

EXPLAIN (COSTS OFF) SELECT * FROM test.num_range_rel WHERE id BETWEEN 100 AND 700;
                           QUERY PLAN                           
----------------------------------------------------------------
 Append
   ->  Index Scan using num_range_rel_1_pkey on num_range_rel_1
         Index Cond: (id >= 100)
   ->  Index Scan using num_range_rel_5_pkey on num_range_rel_5
         Index Cond: (id <= 700)
(5 rows)

SELECT pathman.split_range_partition('test.range_rel_1', '2015-01-15'::DATE);
NOTICE:  Creating new partition...
NOTICE:  Copying data to new partition...
NOTICE:  Altering original partition...
NOTICE:  Done!
  split_range_partition  
-------------------------
 {01-01-2015,02-01-2015}
(1 row)

/* Merge two partitions into one */
SELECT pathman.merge_range_partitions('test.num_range_rel_1', 'test.num_range_rel_' || currval('test.num_range_rel_seq'));
NOTICE:  Altering first partition...
NOTICE:  Copying data...
NOTICE:  Dropping second partition...
NOTICE:  Done!
 merge_range_partitions 
------------------------
 
(1 row)

EXPLAIN (COSTS OFF) SELECT * FROM test.num_range_rel WHERE id BETWEEN 100 AND 700;
                           QUERY PLAN                           
----------------------------------------------------------------
 Append
   ->  Index Scan using num_range_rel_1_pkey on num_range_rel_1
         Index Cond: ((id >= 100) AND (id <= 700))
(3 rows)

SELECT pathman.merge_range_partitions('test.range_rel_1', 'test.range_rel_' || currval('test.range_rel_seq'));
NOTICE:  Altering first partition...
NOTICE:  Copying data...
NOTICE:  Dropping second partition...
NOTICE:  Done!
 merge_range_partitions 
------------------------
 
(1 row)

/* Append and prepend partitions */
SELECT pathman.append_range_partition('test.num_range_rel');
NOTICE:  Appending new partition...
NOTICE:  Done!
 append_range_partition 
------------------------
 test.num_range_rel_6
(1 row)

SELECT pathman.prepend_range_partition('test.num_range_rel');
NOTICE:  Prepending new partition...
NOTICE:  Done!
 prepend_range_partition 
-------------------------
 test.num_range_rel_7
(1 row)

SELECT pathman.drop_range_partition('test.num_range_rel_7');
 drop_range_partition 
----------------------
 test.num_range_rel_7
(1 row)

SELECT pathman.append_range_partition('test.range_rel');
NOTICE:  Appending new partition...
NOTICE:  Done!
 append_range_partition 
------------------------
 test.range_rel_6
(1 row)

SELECT pathman.prepend_range_partition('test.range_rel');
NOTICE:  Prepending new partition...
NOTICE:  Done!
 prepend_range_partition 
-------------------------
 test.range_rel_7
(1 row)

EXPLAIN (COSTS OFF) SELECT * FROM test.range_rel WHERE dt BETWEEN '2014-12-15' AND '2015-01-15';
                                     QUERY PLAN                                      
-------------------------------------------------------------------------------------
 Append
   ->  Index Scan using range_rel_7_dt_idx on range_rel_7
         Index Cond: (dt >= 'Mon Dec 15 00:00:00 2014'::timestamp without time zone)
   ->  Index Scan using range_rel_1_dt_idx on range_rel_1
         Index Cond: (dt <= 'Thu Jan 15 00:00:00 2015'::timestamp without time zone)
(5 rows)

SELECT pathman.drop_range_partition('test.range_rel_7');
 drop_range_partition 
----------------------
 test.range_rel_7
(1 row)

EXPLAIN (COSTS OFF) SELECT * FROM test.range_rel WHERE dt BETWEEN '2014-12-15' AND '2015-01-15';
                                     QUERY PLAN                                      
-------------------------------------------------------------------------------------
 Append
   ->  Index Scan using range_rel_1_dt_idx on range_rel_1
         Index Cond: (dt <= 'Thu Jan 15 00:00:00 2015'::timestamp without time zone)
(3 rows)

SELECT pathman.add_range_partition('test.range_rel', '2014-12-01'::DATE, '2015-01-02'::DATE);
ERROR:  Specified range overlaps with existing partitions P0001
SELECT pathman.add_range_partition('test.range_rel', '2014-12-01'::DATE, '2015-01-01'::DATE);
NOTICE:  Done!
 add_range_partition 
---------------------
 test.range_rel_8
(1 row)

EXPLAIN (COSTS OFF) SELECT * FROM test.range_rel WHERE dt BETWEEN '2014-12-15' AND '2015-01-15';
                                     QUERY PLAN                                      
-------------------------------------------------------------------------------------
 Append
   ->  Index Scan using range_rel_8_dt_idx on range_rel_8
         Index Cond: (dt >= 'Mon Dec 15 00:00:00 2014'::timestamp without time zone)
   ->  Index Scan using range_rel_1_dt_idx on range_rel_1
         Index Cond: (dt <= 'Thu Jan 15 00:00:00 2015'::timestamp without time zone)
(5 rows)

CREATE TABLE test.range_rel_archive (LIKE test.range_rel INCLUDING ALL);
SELECT pathman.attach_range_partition('test.range_rel', 'test.range_rel_archive', '2014-01-01'::DATE, '2015-01-01'::DATE);
ERROR:  Specified range overlaps with existing partitions P0001
SELECT pathman.attach_range_partition('test.range_rel', 'test.range_rel_archive', '2014-01-01'::DATE, '2014-12-01'::DATE);
 attach_range_partition 
------------------------
 test.range_rel_archive
(1 row)

EXPLAIN (COSTS OFF) SELECT * FROM test.range_rel WHERE dt BETWEEN '2014-11-15' AND '2015-01-15';
                                     QUERY PLAN                                      
-------------------------------------------------------------------------------------
 Append
   ->  Index Scan using range_rel_archive_dt_idx on range_rel_archive
         Index Cond: (dt >= 'Sat Nov 15 00:00:00 2014'::timestamp without time zone)
   ->  Seq Scan on range_rel_8
   ->  Index Scan using range_rel_1_dt_idx on range_rel_1
         Index Cond: (dt <= 'Thu Jan 15 00:00:00 2015'::timestamp without time zone)
(6 rows)

SELECT pathman.detach_range_partition('test.range_rel_archive');
 detach_range_partition 
------------------------
 test.range_rel_archive
(1 row)

EXPLAIN (COSTS OFF) SELECT * FROM test.range_rel WHERE dt BETWEEN '2014-11-15' AND '2015-01-15';
                                     QUERY PLAN                                      
-------------------------------------------------------------------------------------
 Append
   ->  Seq Scan on range_rel_8
   ->  Index Scan using range_rel_1_dt_idx on range_rel_1
         Index Cond: (dt <= 'Thu Jan 15 00:00:00 2015'::timestamp without time zone)
(4 rows)

/*
 * Clean up
 */
SELECT pathman.drop_hash_partitions('test.hash_rel');
NOTICE:  drop cascades to trigger test_hash_rel_insert_trigger on table test.hash_rel
NOTICE:  function test.hash_rel_hash_update_trigger_func() does not exist, skipping
NOTICE:  2 rows copied from test.hash_rel_2
NOTICE:  3 rows copied from test.hash_rel_1
NOTICE:  1 rows copied from test.hash_rel_0
 drop_hash_partitions 
----------------------
                    3
(1 row)

SELECT COUNT(*) FROM ONLY test.hash_rel;
 count 
-------
     6
(1 row)

SELECT pathman.create_hash_partitions('test.hash_rel', 'value', 3);
NOTICE:  function test.hash_rel_hash_insert_trigger_func() does not exist, skipping
NOTICE:  function test.hash_rel_hash_update_trigger_func() does not exist, skipping
NOTICE:  Copying data to partitions...
 create_hash_partitions 
------------------------
                      3
(1 row)

SELECT pathman.drop_hash_partitions('test.hash_rel', TRUE);
NOTICE:  drop cascades to trigger test_hash_rel_insert_trigger on table test.hash_rel
NOTICE:  function test.hash_rel_hash_update_trigger_func() does not exist, skipping
 drop_hash_partitions 
----------------------
                    3
(1 row)

SELECT COUNT(*) FROM ONLY test.hash_rel;
 count 
-------
     0
(1 row)

DROP TABLE test.hash_rel CASCADE;
SELECT pathman.drop_range_partitions('test.num_range_rel');
NOTICE:  0 rows copied from test.num_range_rel_6
NOTICE:  2 rows copied from test.num_range_rel_4
NOTICE:  1000 rows copied from test.num_range_rel_3
NOTICE:  1000 rows copied from test.num_range_rel_2
NOTICE:  998 rows copied from test.num_range_rel_1
 drop_range_partitions 
-----------------------
                     5
(1 row)

DROP TABLE test.num_range_rel CASCADE;
DROP TABLE test.range_rel CASCADE;
NOTICE:  drop cascades to 7 other objects
/* Test automatic partition creation */
CREATE TABLE test.range_rel (
    id SERIAL PRIMARY KEY,
    dt TIMESTAMP NOT NULL);
SELECT pathman.create_range_partitions('test.range_rel', 'dt', '2015-01-01'::DATE, '10 days'::INTERVAL, 1);
NOTICE:  Copying data to partitions...
 create_range_partitions 
-------------------------
                       1
(1 row)

INSERT INTO test.range_rel (dt)
SELECT generate_series('2015-01-01', '2015-04-30', '1 day'::interval);
INSERT INTO test.range_rel (dt)
SELECT generate_series('2014-12-31', '2014-12-01', '-1 day'::interval);
EXPLAIN (COSTS OFF) SELECT * FROM test.range_rel WHERE dt = '2014-12-15';
                                   QUERY PLAN                                   
--------------------------------------------------------------------------------
 Append
   ->  Seq Scan on range_rel_14
         Filter: (dt = 'Mon Dec 15 00:00:00 2014'::timestamp without time zone)
(3 rows)

SELECT * FROM test.range_rel WHERE dt = '2014-12-15';
 id  |            dt            
-----+--------------------------
 137 | Mon Dec 15 00:00:00 2014
(1 row)

EXPLAIN (COSTS OFF) SELECT * FROM test.range_rel WHERE dt = '2015-03-15';
                                   QUERY PLAN                                   
--------------------------------------------------------------------------------
 Append
   ->  Seq Scan on range_rel_8
         Filter: (dt = 'Sun Mar 15 00:00:00 2015'::timestamp without time zone)
(3 rows)

SELECT * FROM test.range_rel WHERE dt = '2015-03-15';
 id |            dt            
----+--------------------------
 74 | Sun Mar 15 00:00:00 2015
(1 row)

DROP TABLE test.range_rel CASCADE;
NOTICE:  drop cascades to 16 other objects
SELECT * FROM pathman.pathman_config;
 id | relname | attname | parttype | range_interval 
----+---------+---------+----------+----------------
(0 rows)

/* Check overlaps */
CREATE TABLE test.num_range_rel (
    id SERIAL PRIMARY KEY,
    txt TEXT);
SELECT pathman.create_range_partitions('test.num_range_rel', 'id', 1000, 1000, 4);
NOTICE:  Copying data to partitions...
 create_range_partitions 
-------------------------
                       4
(1 row)

SELECT pathman.check_overlap('test.num_range_rel'::regclass::oid, 4001, 5000);
 check_overlap 
---------------
 t
(1 row)

SELECT pathman.check_overlap('test.num_range_rel'::regclass::oid, 4000, 5000);
 check_overlap 
---------------
 t
(1 row)

SELECT pathman.check_overlap('test.num_range_rel'::regclass::oid, 3999, 5000);
 check_overlap 
---------------
 t
(1 row)

SELECT pathman.check_overlap('test.num_range_rel'::regclass::oid, 3000, 3500);
 check_overlap 
---------------
 t
(1 row)

SELECT pathman.check_overlap('test.num_range_rel'::regclass::oid, 0, 999);
 check_overlap 
---------------
 f
(1 row)

SELECT pathman.check_overlap('test.num_range_rel'::regclass::oid, 0, 1000);
 check_overlap 
---------------
 f
(1 row)

SELECT pathman.check_overlap('test.num_range_rel'::regclass::oid, 0, 1001);
 check_overlap 
---------------
 t
(1 row)

DROP EXTENSION pg_pathman;
/* Test that everithing works fine without schemas */
CREATE EXTENSION pg_pathman;
/* Hash */
CREATE TABLE hash_rel (
    id      SERIAL PRIMARY KEY,
    value   INTEGER NOT NULL);
INSERT INTO hash_rel (value) SELECT g FROM generate_series(1, 10000) as g;
SELECT create_hash_partitions('hash_rel', 'value', 3);
NOTICE:  function hash_rel_hash_insert_trigger_func() does not exist, skipping
NOTICE:  function hash_rel_hash_update_trigger_func() does not exist, skipping
NOTICE:  Copying data to partitions...
 create_hash_partitions 
------------------------
                      3
(1 row)

EXPLAIN (COSTS OFF) SELECT * FROM hash_rel WHERE id = 1234;
                      QUERY PLAN                      
------------------------------------------------------
 Append
   ->  Index Scan using hash_rel_0_pkey on hash_rel_0
         Index Cond: (id = 1234)
   ->  Index Scan using hash_rel_1_pkey on hash_rel_1
         Index Cond: (id = 1234)
   ->  Index Scan using hash_rel_2_pkey on hash_rel_2
         Index Cond: (id = 1234)
(7 rows)

/* Range */
CREATE TABLE range_rel (
    id SERIAL PRIMARY KEY,
    dt TIMESTAMP NOT NULL);
INSERT INTO range_rel (dt) SELECT g FROM generate_series('2010-01-01'::date, '2010-12-31'::date, '1 day') as g;
SELECT create_range_partitions('range_rel', 'dt', '2010-01-01'::date, '1 month'::interval, 12);
NOTICE:  sequence "range_rel_seq" does not exist, skipping
NOTICE:  Copying data to partitions...
 create_range_partitions 
-------------------------
                      12
(1 row)

SELECT merge_range_partitions('range_rel_1', 'range_rel_2');
NOTICE:  Altering first partition...
NOTICE:  Copying data...
NOTICE:  Dropping second partition...
NOTICE:  Done!
 merge_range_partitions 
------------------------
 
(1 row)

SELECT split_range_partition('range_rel_1', '2010-02-15'::date);
NOTICE:  Creating new partition...
NOTICE:  Copying data to new partition...
NOTICE:  Altering original partition...
NOTICE:  Done!
  split_range_partition  
-------------------------
 {01-01-2010,03-01-2010}
(1 row)

SELECT append_range_partition('range_rel');
NOTICE:  Appending new partition...
NOTICE:  Done!
 append_range_partition 
------------------------
 public.range_rel_14
(1 row)

SELECT prepend_range_partition('range_rel');
NOTICE:  Prepending new partition...
NOTICE:  Done!
 prepend_range_partition 
-------------------------
 public.range_rel_15
(1 row)

EXPLAIN (COSTS OFF) SELECT * FROM range_rel WHERE dt < '2010-03-01';
           QUERY PLAN           
--------------------------------
 Append
   ->  Seq Scan on range_rel_15
   ->  Seq Scan on range_rel_1
   ->  Seq Scan on range_rel_13
(4 rows)

EXPLAIN (COSTS OFF) SELECT * FROM range_rel WHERE dt > '2010-12-15';
                                   QUERY PLAN                                   
--------------------------------------------------------------------------------
 Append
   ->  Seq Scan on range_rel_12
         Filter: (dt > 'Wed Dec 15 00:00:00 2010'::timestamp without time zone)
   ->  Seq Scan on range_rel_14
(4 rows)

/* Create range partitions from whole range */
SELECT drop_range_partitions('range_rel');
NOTICE:  0 rows copied from range_rel_15
NOTICE:  0 rows copied from range_rel_14
NOTICE:  14 rows copied from range_rel_13
NOTICE:  31 rows copied from range_rel_12
NOTICE:  30 rows copied from range_rel_11
NOTICE:  31 rows copied from range_rel_10
NOTICE:  30 rows copied from range_rel_9
NOTICE:  31 rows copied from range_rel_8
NOTICE:  31 rows copied from range_rel_7
NOTICE:  30 rows copied from range_rel_6
NOTICE:  31 rows copied from range_rel_5
NOTICE:  30 rows copied from range_rel_4
NOTICE:  31 rows copied from range_rel_3
NOTICE:  45 rows copied from range_rel_1
 drop_range_partitions 
-----------------------
                    14
(1 row)

SELECT create_partitions_from_range('range_rel', 'id', 1, 1000, 100);
NOTICE:  Copying data to partitions...
 create_partitions_from_range 
------------------------------
                           10
(1 row)

SELECT drop_range_partitions('range_rel', TRUE);
 drop_range_partitions 
-----------------------
                    10
(1 row)

SELECT create_partitions_from_range('range_rel', 'dt', '2015-01-01'::date, '2015-12-01'::date, '1 month'::interval);
NOTICE:  Copying data to partitions...
 create_partitions_from_range 
------------------------------
                           12
(1 row)

EXPLAIN (COSTS OFF) SELECT * FROM range_rel WHERE dt = '2015-12-15';
                                   QUERY PLAN                                   
--------------------------------------------------------------------------------
 Append
   ->  Seq Scan on range_rel_12
         Filter: (dt = 'Tue Dec 15 00:00:00 2015'::timestamp without time zone)
(3 rows)

CREATE TABLE messages(id SERIAL PRIMARY KEY, msg TEXT);
CREATE TABLE replies(id SERIAL PRIMARY KEY, message_id INTEGER REFERENCES messages(id),  msg TEXT);
INSERT INTO messages SELECT g, md5(g::text) FROM generate_series(1, 10) as g;
INSERT INTO replies SELECT g, g, md5(g::text) FROM generate_series(1, 10) as g;
SELECT create_range_partitions('messages', 'id', 1, 100, 2);
WARNING:  Foreign key 'replies_message_id_fkey' references to the relation 'public.messages'
ERROR:  Relation 'public.messages' is referenced from other relations P0001
ALTER TABLE replies DROP CONSTRAINT replies_message_id_fkey;
SELECT create_range_partitions('messages', 'id', 1, 100, 2);
NOTICE:  sequence "messages_seq" does not exist, skipping
NOTICE:  Copying data to partitions...
 create_range_partitions 
-------------------------
                       2
(1 row)

EXPLAIN (COSTS OFF) SELECT * FROM messages;
          QUERY PLAN          
------------------------------
 Append
   ->  Seq Scan on messages_1
   ->  Seq Scan on messages_2
(3 rows)

DROP EXTENSION pg_pathman;
